{
 "$comment": "Extracted from github/rest-api-description@bb754941722779d8a5b3a2f25a5fbb7ce794e1ea",
 "$defs": {
  "author-association": {
   "enum": [
    "COLLABORATOR",
    "CONTRIBUTOR",
    "FIRST_TIMER",
    "FIRST_TIME_CONTRIBUTOR",
    "MANNEQUIN",
    "MEMBER",
    "NONE",
    "OWNER"
   ],
   "title": "author_association",
   "type": "string"
  },
  "nullable-simple-user": {
   "anyOf": [
    {
     "properties": {
      "avatar_url": {
       "format": "uri",
       "type": "string"
      },
      "email": {
       "anyOf": [
        {
         "type": "string"
        },
        {
         "type": "null"
        }
       ]
      },
      "events_url": {
       "type": "string"
      },
      "followers_url": {
       "format": "uri",
       "type": "string"
      },
      "following_url": {
       "type": "string"
      },
      "gists_url": {
       "type": "string"
      },
      "gravatar_id": {
       "anyOf": [
        {
         "type": "string"
        },
        {
         "type": "null"
        }
       ]
      },
      "html_url": {
       "format": "uri",
       "type": "string"
      },
      "id": {
       "format": "int64",
       "type": "integer"
      },
      "login": {
       "type": "string"
      },
      "name": {
       "anyOf": [
        {
         "type": "string"
        },
        {
         "type": "null"
        }
       ]
      },
      "node_id": {
       "type": "string"
      },
      "organizations_url": {
       "format": "uri",
       "type": "string"
      },
      "received_events_url": {
       "format": "uri",
       "type": "string"
      },
      "repos_url": {
       "format": "uri",
       "type": "string"
      },
      "site_admin": {
       "type": "boolean"
      },
      "starred_at": {
       "type": "string"
      },
      "starred_url": {
       "type": "string"
      },
      "subscriptions_url": {
       "format": "uri",
       "type": "string"
      },
      "type": {
       "type": "string"
      },
      "url": {
       "format": "uri",
       "type": "string"
      },
      "user_view_type": {
       "type": "string"
      }
     },
     "required": [
      "avatar_url",
      "events_url",
      "followers_url",
      "following_url",
      "gists_url",
      "gravatar_id",
      "html_url",
      "id",
      "node_id",
      "login",
      "organizations_url",
      "received_events_url",
      "repos_url",
      "site_admin",
      "starred_url",
      "subscriptions_url",
      "type",
      "url"
     ],
     "title": "Simple User",
     "type": "object"
    },
    {
     "type": "null"
    }
   ]
  }
 },
 "$schema": "https://json-schema.org/draft/2020-12/schema",
 "properties": {
  "_links": {
   "properties": {
    "html": {
     "properties": {
      "href": {
       "type": "string"
      }
     },
     "required": [
      "href"
     ],
     "type": "object"
    },
    "pull_request": {
     "properties": {
      "href": {
       "type": "string"
      }
     },
     "required": [
      "href"
     ],
     "type": "object"
    }
   },
   "required": [
    "html",
    "pull_request"
   ],
   "type": "object"
  },
  "author_association": {
   "$ref": "#/$defs/author-association"
  },
  "body": {
   "type": "string"
  },
  "body_html": {
   "type": "string"
  },
  "body_text": {
   "type": "string"
  },
  "commit_id": {
   "anyOf": [
    {
     "type": "string"
    },
    {
     "type": "null"
    }
   ]
  },
  "html_url": {
   "format": "uri",
   "type": "string"
  },
  "id": {
   "format": "int64",
   "type": "integer"
  },
  "node_id": {
   "type": "string"
  },
  "pull_request_url": {
   "format": "uri",
   "type": "string"
  },
  "state": {
   "type": "string"
  },
  "submitted_at": {
   "format": "date-time",
   "type": "string"
  },
  "user": {
   "$ref": "#/$defs/nullable-simple-user"
  }
 },
 "required": [
  "id",
  "node_id",
  "user",
  "body",
  "state",
  "commit_id",
  "html_url",
  "pull_request_url",
  "_links",
  "author_association"
 ],
 "title": "Pull Request Review",
 "type": "object"
}
