[
  {
    "_links": {
      "html": {
        "href": "https://github.example/fernhill-oss/lamina/pull/55#pullrequestreview-1900002210"
      },
      "pull_request": {
        "href": "https://api.github.example/repos/fernhill-oss/lamina/pulls/55"
      }
    },
    "author_association": "MEMBER",
    "body": "A few security notes.\n\nBuild and release scripts have to be reproducible: this fetches something at build time. Please vendor it or pin it by hash, outside the build.\n\nI can't review a binary blob. Can you add the source and the checksum to scripts/build_fixtures.py?",
    "commit_id": "2998dd381c9dfdde26c4fd9c5c4f735755003e1b",
    "html_url": "https://github.example/fernhill-oss/lamina/pull/55#pullrequestreview-1900002210",
    "id": 1900002210,
    "node_id": "PRR_kwDOuTWJg9U4qbQk",
    "pull_request_url": "https://api.github.example/repos/fernhill-oss/lamina/pulls/55",
    "state": "CHANGES_REQUESTED",
    "submitted_at": "2024-06-27T07:39:55Z",
    "user": {
      "avatar_url": "https://avatars.github.example/u/1450109?v=4",
      "events_url": "https://api.github.example/users/ravi-m/events{/privacy}",
      "followers_url": "https://api.github.example/users/ravi-m/followers",
      "following_url": "https://api.github.example/users/ravi-m/following{/other_user}",
      "gists_url": "https://api.github.example/users/ravi-m/gists{/gist_id}",
      "gravatar_id": "",
      "html_url": "https://github.example/ravi-m",
      "id": 1450109,
      "login": "ravi-m",
      "node_id": "U_kwDOWffkXw7tFgOq",
      "organizations_url": "https://api.github.example/users/ravi-m/orgs",
      "received_events_url": "https://api.github.example/users/ravi-m/received_events",
      "repos_url": "https://api.github.example/users/ravi-m/repos",
      "site_admin": false,
      "starred_url": "https://api.github.example/users/ravi-m/starred{/owner}{/repo}",
      "subscriptions_url": "https://api.github.example/users/ravi-m/subscriptions",
      "type": "User",
      "url": "https://api.github.example/users/ravi-m",
      "user_view_type": "public"
    }
  },
  {
    "_links": {
      "html": {
        "href": "https://github.example/fernhill-oss/lamina/pull/55#pullrequestreview-1900002221"
      },
      "pull_request": {
        "href": "https://api.github.example/repos/fernhill-oss/lamina/pulls/55"
      }
    },
    "author_association": "OWNER",
    "body": "LGTM, thanks!",
    "commit_id": "2998dd381c9dfdde26c4fd9c5c4f735755003e1b",
    "html_url": "https://github.example/fernhill-oss/lamina/pull/55#pullrequestreview-1900002221",
    "id": 1900002221,
    "node_id": "PRR_kwDOTYrztNu_Tt1u",
    "pull_request_url": "https://api.github.example/repos/fernhill-oss/lamina/pulls/55",
    "state": "APPROVED",
    "submitted_at": "2024-06-27T09:44:55Z",
    "user": {
      "avatar_url": "https://avatars.github.example/u/1435687?v=4",
      "events_url": "https://api.github.example/users/ines-v/events{/privacy}",
      "followers_url": "https://api.github.example/users/ines-v/followers",
      "following_url": "https://api.github.example/users/ines-v/following{/other_user}",
      "gists_url": "https://api.github.example/users/ines-v/gists{/gist_id}",
      "gravatar_id": "",
      "html_url": "https://github.example/ines-v",
      "id": 1435687,
      "login": "ines-v",
      "node_id": "U_kwDO9-6tTCS76lqQ",
      "organizations_url": "https://api.github.example/users/ines-v/orgs",
      "received_events_url": "https://api.github.example/users/ines-v/received_events",
      "repos_url": "https://api.github.example/users/ines-v/repos",
      "site_admin": false,
      "starred_url": "https://api.github.example/users/ines-v/starred{/owner}{/repo}",
      "subscriptions_url": "https://api.github.example/users/ines-v/subscriptions",
      "type": "User",
      "url": "https://api.github.example/users/ines-v",
      "user_view_type": "public"
    }
  },
  {
    "_links": {
      "html": {
        "href": "https://github.example/fernhill-oss/lamina/pull/55#pullrequestreview-1900002250"
      },
      "pull_request": {
        "href": "https://api.github.example/repos/fernhill-oss/lamina/pulls/55"
      }
    },
    "author_association": "MEMBER",
    "body": "Fine by me security-wise.",
    "commit_id": "f914ae0f7ded07afde4052011051c5422024ed16",
    "html_url": "https://github.example/fernhill-oss/lamina/pull/55#pullrequestreview-1900002250",
    "id": 1900002250,
    "node_id": "PRR_kwDO9ZOl_5sMyVNG",
    "pull_request_url": "https://api.github.example/repos/fernhill-oss/lamina/pulls/55",
    "state": "APPROVED",
    "submitted_at": "2024-07-01T07:53:14Z",
    "user": {
      "avatar_url": "https://avatars.github.example/u/1450109?v=4",
      "events_url": "https://api.github.example/users/ravi-m/events{/privacy}",
      "followers_url": "https://api.github.example/users/ravi-m/followers",
      "following_url": "https://api.github.example/users/ravi-m/following{/other_user}",
      "gists_url": "https://api.github.example/users/ravi-m/gists{/gist_id}",
      "gravatar_id": "",
      "html_url": "https://github.example/ravi-m",
      "id": 1450109,
      "login": "ravi-m",
      "node_id": "U_kwDOWffkXw7tFgOq",
      "organizations_url": "https://api.github.example/users/ravi-m/orgs",
      "received_events_url": "https://api.github.example/users/ravi-m/received_events",
      "repos_url": "https://api.github.example/users/ravi-m/repos",
      "site_admin": false,
      "starred_url": "https://api.github.example/users/ravi-m/starred{/owner}{/repo}",
      "subscriptions_url": "https://api.github.example/users/ravi-m/subscriptions",
      "type": "User",
      "url": "https://api.github.example/users/ravi-m",
      "user_view_type": "public"
    }
  }
]
