[
  {
    "_links": {
      "html": {
        "href": "https://github.example/fernhill-oss/lamina/pull/301#pullrequestreview-1900010491"
      },
      "pull_request": {
        "href": "https://api.github.example/repos/fernhill-oss/lamina/pulls/301"
      }
    },
    "author_association": "OWNER",
    "body": "Looks good, thank you.",
    "commit_id": "2ef7955d260ae46da5be7fcfca42f6659cddd6f1",
    "html_url": "https://github.example/fernhill-oss/lamina/pull/301#pullrequestreview-1900010491",
    "id": 1900010491,
    "node_id": "PRR_kwDORXig8EKN3THK",
    "pull_request_url": "https://api.github.example/repos/fernhill-oss/lamina/pulls/301",
    "state": "APPROVED",
    "submitted_at": "2026-07-16T13:01:40Z",
    "user": {
      "avatar_url": "https://avatars.github.example/u/1435687?v=4",
      "events_url": "https://api.github.example/users/ines-v/events{/privacy}",
      "followers_url": "https://api.github.example/users/ines-v/followers",
      "following_url": "https://api.github.example/users/ines-v/following{/other_user}",
      "gists_url": "https://api.github.example/users/ines-v/gists{/gist_id}",
      "gravatar_id": "",
      "html_url": "https://github.example/ines-v",
      "id": 1435687,
      "login": "ines-v",
      "node_id": "U_kwDO9-6tTCS76lqQ",
      "organizations_url": "https://api.github.example/users/ines-v/orgs",
      "received_events_url": "https://api.github.example/users/ines-v/received_events",
      "repos_url": "https://api.github.example/users/ines-v/repos",
      "site_admin": false,
      "starred_url": "https://api.github.example/users/ines-v/starred{/owner}{/repo}",
      "subscriptions_url": "https://api.github.example/users/ines-v/subscriptions",
      "type": "User",
      "url": "https://api.github.example/users/ines-v",
      "user_view_type": "public"
    }
  },
  {
    "_links": {
      "html": {
        "href": "https://github.example/fernhill-oss/lamina/pull/301#pullrequestreview-1900010525"
      },
      "pull_request": {
        "href": "https://api.github.example/repos/fernhill-oss/lamina/pulls/301"
      }
    },
    "author_association": "MEMBER",
    "body": "A few security notes.\n\nBuild and release scripts have to be reproducible: this fetches something at build time. Please vendor it or pin it by hash, outside the build.\n\nA binary fixture without a generator script and a checksum: please commit what produces it and its sha256, so we can regenerate and verify it.",
    "commit_id": "2ef7955d260ae46da5be7fcfca42f6659cddd6f1",
    "html_url": "https://github.example/fernhill-oss/lamina/pull/301#pullrequestreview-1900010525",
    "id": 1900010525,
    "node_id": "PRR_kwDOZzIGQxvlKaOm",
    "pull_request_url": "https://api.github.example/repos/fernhill-oss/lamina/pulls/301",
    "state": "CHANGES_REQUESTED",
    "submitted_at": "2026-07-16T15:31:40Z",
    "user": {
      "avatar_url": "https://avatars.github.example/u/1450109?v=4",
      "events_url": "https://api.github.example/users/ravi-m/events{/privacy}",
      "followers_url": "https://api.github.example/users/ravi-m/followers",
      "following_url": "https://api.github.example/users/ravi-m/following{/other_user}",
      "gists_url": "https://api.github.example/users/ravi-m/gists{/gist_id}",
      "gravatar_id": "",
      "html_url": "https://github.example/ravi-m",
      "id": 1450109,
      "login": "ravi-m",
      "node_id": "U_kwDOWffkXw7tFgOq",
      "organizations_url": "https://api.github.example/users/ravi-m/orgs",
      "received_events_url": "https://api.github.example/users/ravi-m/received_events",
      "repos_url": "https://api.github.example/users/ravi-m/repos",
      "site_admin": false,
      "starred_url": "https://api.github.example/users/ravi-m/starred{/owner}{/repo}",
      "subscriptions_url": "https://api.github.example/users/ravi-m/subscriptions",
      "type": "User",
      "url": "https://api.github.example/users/ravi-m",
      "user_view_type": "public"
    }
  },
  {
    "_links": {
      "html": {
        "href": "https://github.example/fernhill-oss/lamina/pull/301#pullrequestreview-1900010632"
      },
      "pull_request": {
        "href": "https://api.github.example/repos/fernhill-oss/lamina/pulls/301"
      }
    },
    "author_association": "MEMBER",
    "body": "",
    "commit_id": "21f20932684397497d75452e7512fa94011f54d6",
    "html_url": "https://github.example/fernhill-oss/lamina/pull/301#pullrequestreview-1900010632",
    "id": 1900010632,
    "node_id": "PRR_kwDOoJ-ffHC3R1B2",
    "pull_request_url": "https://api.github.example/repos/fernhill-oss/lamina/pulls/301",
    "state": "APPROVED",
    "submitted_at": "2026-07-20T09:18:50Z",
    "user": {
      "avatar_url": "https://avatars.github.example/u/1450109?v=4",
      "events_url": "https://api.github.example/users/ravi-m/events{/privacy}",
      "followers_url": "https://api.github.example/users/ravi-m/followers",
      "following_url": "https://api.github.example/users/ravi-m/following{/other_user}",
      "gists_url": "https://api.github.example/users/ravi-m/gists{/gist_id}",
      "gravatar_id": "",
      "html_url": "https://github.example/ravi-m",
      "id": 1450109,
      "login": "ravi-m",
      "node_id": "U_kwDOWffkXw7tFgOq",
      "organizations_url": "https://api.github.example/users/ravi-m/orgs",
      "received_events_url": "https://api.github.example/users/ravi-m/received_events",
      "repos_url": "https://api.github.example/users/ravi-m/repos",
      "site_admin": false,
      "starred_url": "https://api.github.example/users/ravi-m/starred{/owner}{/repo}",
      "subscriptions_url": "https://api.github.example/users/ravi-m/subscriptions",
      "type": "User",
      "url": "https://api.github.example/users/ravi-m",
      "user_view_type": "public"
    }
  }
]
