[
  {
    "_links": {
      "html": {
        "href": "https://github.example/fernhill-oss/lamina/pull/3#pullrequestreview-1900000052"
      },
      "pull_request": {
        "href": "https://api.github.example/repos/fernhill-oss/lamina/pulls/3"
      }
    },
    "author_association": "OWNER",
    "body": "Looks good, thank you.",
    "commit_id": "dbebe3717d484b902ba5017f52a22a946b560f25",
    "html_url": "https://github.example/fernhill-oss/lamina/pull/3#pullrequestreview-1900000052",
    "id": 1900000052,
    "node_id": "PRR_kwDOMR2pF5LzsdBj",
    "pull_request_url": "https://api.github.example/repos/fernhill-oss/lamina/pulls/3",
    "state": "APPROVED",
    "submitted_at": "2023-11-22T09:12:14Z",
    "user": {
      "avatar_url": "https://avatars.github.example/u/1435687?v=4",
      "events_url": "https://api.github.example/users/ines-v/events{/privacy}",
      "followers_url": "https://api.github.example/users/ines-v/followers",
      "following_url": "https://api.github.example/users/ines-v/following{/other_user}",
      "gists_url": "https://api.github.example/users/ines-v/gists{/gist_id}",
      "gravatar_id": "",
      "html_url": "https://github.example/ines-v",
      "id": 1435687,
      "login": "ines-v",
      "node_id": "U_kwDO9-6tTCS76lqQ",
      "organizations_url": "https://api.github.example/users/ines-v/orgs",
      "received_events_url": "https://api.github.example/users/ines-v/received_events",
      "repos_url": "https://api.github.example/users/ines-v/repos",
      "site_admin": false,
      "starred_url": "https://api.github.example/users/ines-v/starred{/owner}{/repo}",
      "subscriptions_url": "https://api.github.example/users/ines-v/subscriptions",
      "type": "User",
      "url": "https://api.github.example/users/ines-v",
      "user_view_type": "public"
    }
  }
]
