[
  {
    "_links": {
      "html": {
        "href": "https://github.example/fernhill-oss/lamina/pull/95#pullrequestreview-1900003444"
      },
      "pull_request": {
        "href": "https://api.github.example/repos/fernhill-oss/lamina/pulls/95"
      }
    },
    "author_association": "CONTRIBUTOR",
    "body": "",
    "commit_id": "38c318d1c694be300e60ed7eba0ab046c36d0463",
    "html_url": "https://github.example/fernhill-oss/lamina/pull/95#pullrequestreview-1900003444",
    "id": 1900003444,
    "node_id": "PRR_kwDOcjPEE4TT9xfC",
    "pull_request_url": "https://api.github.example/repos/fernhill-oss/lamina/pulls/95",
    "state": "APPROVED",
    "submitted_at": "2024-12-24T12:39:47Z",
    "user": {
      "avatar_url": "https://avatars.github.example/u/1595507?v=4",
      "events_url": "https://api.github.example/users/lena-b/events{/privacy}",
      "followers_url": "https://api.github.example/users/lena-b/followers",
      "following_url": "https://api.github.example/users/lena-b/following{/other_user}",
      "gists_url": "https://api.github.example/users/lena-b/gists{/gist_id}",
      "gravatar_id": "",
      "html_url": "https://github.example/lena-b",
      "id": 1595507,
      "login": "lena-b",
      "node_id": "U_kwDONKOpz1N3FcrR",
      "organizations_url": "https://api.github.example/users/lena-b/orgs",
      "received_events_url": "https://api.github.example/users/lena-b/received_events",
      "repos_url": "https://api.github.example/users/lena-b/repos",
      "site_admin": false,
      "starred_url": "https://api.github.example/users/lena-b/starred{/owner}{/repo}",
      "subscriptions_url": "https://api.github.example/users/lena-b/subscriptions",
      "type": "User",
      "url": "https://api.github.example/users/lena-b",
      "user_view_type": "public"
    }
  }
]
