[
  {
    "_links": {
      "html": {
        "href": "https://github.example/fernhill-oss/lamina/pull/79#pullrequestreview-1900003139"
      },
      "pull_request": {
        "href": "https://api.github.example/repos/fernhill-oss/lamina/pulls/79"
      }
    },
    "author_association": "OWNER",
    "body": "A few things before this can go in.\n\nNeeds a test before it can go in.",
    "commit_id": "0255c423b014133db7d3a9e3b08dd295402bad60",
    "html_url": "https://github.example/fernhill-oss/lamina/pull/79#pullrequestreview-1900003139",
    "id": 1900003139,
    "node_id": "PRR_kwDOPZRDSBVHe32M",
    "pull_request_url": "https://api.github.example/repos/fernhill-oss/lamina/pulls/79",
    "state": "CHANGES_REQUESTED",
    "submitted_at": "2024-10-04T16:44:20Z",
    "user": {
      "avatar_url": "https://avatars.github.example/u/1435687?v=4",
      "events_url": "https://api.github.example/users/ines-v/events{/privacy}",
      "followers_url": "https://api.github.example/users/ines-v/followers",
      "following_url": "https://api.github.example/users/ines-v/following{/other_user}",
      "gists_url": "https://api.github.example/users/ines-v/gists{/gist_id}",
      "gravatar_id": "",
      "html_url": "https://github.example/ines-v",
      "id": 1435687,
      "login": "ines-v",
      "node_id": "U_kwDO9-6tTCS76lqQ",
      "organizations_url": "https://api.github.example/users/ines-v/orgs",
      "received_events_url": "https://api.github.example/users/ines-v/received_events",
      "repos_url": "https://api.github.example/users/ines-v/repos",
      "site_admin": false,
      "starred_url": "https://api.github.example/users/ines-v/starred{/owner}{/repo}",
      "subscriptions_url": "https://api.github.example/users/ines-v/subscriptions",
      "type": "User",
      "url": "https://api.github.example/users/ines-v",
      "user_view_type": "public"
    }
  },
  {
    "_links": {
      "html": {
        "href": "https://github.example/fernhill-oss/lamina/pull/79#pullrequestreview-1900003141"
      },
      "pull_request": {
        "href": "https://api.github.example/repos/fernhill-oss/lamina/pulls/79"
      }
    },
    "author_association": "FIRST_TIME_CONTRIBUTOR",
    "body": "",
    "commit_id": "f414a07e67431df7ed9f8ccf0c61455fdfa0c968",
    "html_url": "https://github.example/fernhill-oss/lamina/pull/79#pullrequestreview-1900003141",
    "id": 1900003141,
    "node_id": "PRR_kwDO-KlGgQPvX2pZ",
    "pull_request_url": "https://api.github.example/repos/fernhill-oss/lamina/pulls/79",
    "state": "COMMENTED",
    "submitted_at": "2024-10-05T01:38:23Z",
    "user": {
      "avatar_url": "https://avatars.github.example/u/15515368?v=4",
      "events_url": "https://api.github.example/users/umar-j85/events{/privacy}",
      "followers_url": "https://api.github.example/users/umar-j85/followers",
      "following_url": "https://api.github.example/users/umar-j85/following{/other_user}",
      "gists_url": "https://api.github.example/users/umar-j85/gists{/gist_id}",
      "gravatar_id": "",
      "html_url": "https://github.example/umar-j85",
      "id": 15515368,
      "login": "umar-j85",
      "node_id": "U_kwDOu4kF9y8zPPBO",
      "organizations_url": "https://api.github.example/users/umar-j85/orgs",
      "received_events_url": "https://api.github.example/users/umar-j85/received_events",
      "repos_url": "https://api.github.example/users/umar-j85/repos",
      "site_admin": false,
      "starred_url": "https://api.github.example/users/umar-j85/starred{/owner}{/repo}",
      "subscriptions_url": "https://api.github.example/users/umar-j85/subscriptions",
      "type": "User",
      "url": "https://api.github.example/users/umar-j85",
      "user_view_type": "public"
    }
  },
  {
    "_links": {
      "html": {
        "href": "https://github.example/fernhill-oss/lamina/pull/79#pullrequestreview-1900003166"
      },
      "pull_request": {
        "href": "https://api.github.example/repos/fernhill-oss/lamina/pulls/79"
      }
    },
    "author_association": "OWNER",
    "body": "",
    "commit_id": "f414a07e67431df7ed9f8ccf0c61455fdfa0c968",
    "html_url": "https://github.example/fernhill-oss/lamina/pull/79#pullrequestreview-1900003166",
    "id": 1900003166,
    "node_id": "PRR_kwDOpHavtUBGJ2Dz",
    "pull_request_url": "https://api.github.example/repos/fernhill-oss/lamina/pulls/79",
    "state": "APPROVED",
    "submitted_at": "2024-10-07T14:12:31Z",
    "user": {
      "avatar_url": "https://avatars.github.example/u/1435687?v=4",
      "events_url": "https://api.github.example/users/ines-v/events{/privacy}",
      "followers_url": "https://api.github.example/users/ines-v/followers",
      "following_url": "https://api.github.example/users/ines-v/following{/other_user}",
      "gists_url": "https://api.github.example/users/ines-v/gists{/gist_id}",
      "gravatar_id": "",
      "html_url": "https://github.example/ines-v",
      "id": 1435687,
      "login": "ines-v",
      "node_id": "U_kwDO9-6tTCS76lqQ",
      "organizations_url": "https://api.github.example/users/ines-v/orgs",
      "received_events_url": "https://api.github.example/users/ines-v/received_events",
      "repos_url": "https://api.github.example/users/ines-v/repos",
      "site_admin": false,
      "starred_url": "https://api.github.example/users/ines-v/starred{/owner}{/repo}",
      "subscriptions_url": "https://api.github.example/users/ines-v/subscriptions",
      "type": "User",
      "url": "https://api.github.example/users/ines-v",
      "user_view_type": "public"
    }
  }
]
