[
  {
    "_links": {
      "html": {
        "href": "https://github.example/fernhill-oss/lamina/pull/111#pullrequestreview-1900003757"
      },
      "pull_request": {
        "href": "https://api.github.example/repos/fernhill-oss/lamina/pulls/111"
      }
    },
    "author_association": "OWNER",
    "body": "A few things before this can go in.",
    "commit_id": "e1d98107339889f5d6baec39d2ec7cfd15b1bc79",
    "html_url": "https://github.example/fernhill-oss/lamina/pull/111#pullrequestreview-1900003757",
    "id": 1900003757,
    "node_id": "PRR_kwDOfQXxAGTD6X9B",
    "pull_request_url": "https://api.github.example/repos/fernhill-oss/lamina/pulls/111",
    "state": "CHANGES_REQUESTED",
    "submitted_at": "2025-02-03T11:20:23Z",
    "user": {
      "avatar_url": "https://avatars.github.example/u/1435687?v=4",
      "events_url": "https://api.github.example/users/ines-v/events{/privacy}",
      "followers_url": "https://api.github.example/users/ines-v/followers",
      "following_url": "https://api.github.example/users/ines-v/following{/other_user}",
      "gists_url": "https://api.github.example/users/ines-v/gists{/gist_id}",
      "gravatar_id": "",
      "html_url": "https://github.example/ines-v",
      "id": 1435687,
      "login": "ines-v",
      "node_id": "U_kwDO9-6tTCS76lqQ",
      "organizations_url": "https://api.github.example/users/ines-v/orgs",
      "received_events_url": "https://api.github.example/users/ines-v/received_events",
      "repos_url": "https://api.github.example/users/ines-v/repos",
      "site_admin": false,
      "starred_url": "https://api.github.example/users/ines-v/starred{/owner}{/repo}",
      "subscriptions_url": "https://api.github.example/users/ines-v/subscriptions",
      "type": "User",
      "url": "https://api.github.example/users/ines-v",
      "user_view_type": "public"
    }
  },
  {
    "_links": {
      "html": {
        "href": "https://github.example/fernhill-oss/lamina/pull/111#pullrequestreview-1900003770"
      },
      "pull_request": {
        "href": "https://api.github.example/repos/fernhill-oss/lamina/pulls/111"
      }
    },
    "author_association": "FIRST_TIME_CONTRIBUTOR",
    "body": "",
    "commit_id": "821cfc35527d1193cf6e810e8be21671cc33e002",
    "html_url": "https://github.example/fernhill-oss/lamina/pull/111#pullrequestreview-1900003770",
    "id": 1900003770,
    "node_id": "PRR_kwDOsIyEKyIOhU54",
    "pull_request_url": "https://api.github.example/repos/fernhill-oss/lamina/pulls/111",
    "state": "COMMENTED",
    "submitted_at": "2025-02-04T03:33:06Z",
    "user": {
      "avatar_url": "https://avatars.github.example/u/18689775?v=4",
      "events_url": "https://api.github.example/users/marco-j98/events{/privacy}",
      "followers_url": "https://api.github.example/users/marco-j98/followers",
      "following_url": "https://api.github.example/users/marco-j98/following{/other_user}",
      "gists_url": "https://api.github.example/users/marco-j98/gists{/gist_id}",
      "gravatar_id": "",
      "html_url": "https://github.example/marco-j98",
      "id": 18689775,
      "login": "marco-j98",
      "node_id": "U_kwDOxJA5umKmO3hZ",
      "organizations_url": "https://api.github.example/users/marco-j98/orgs",
      "received_events_url": "https://api.github.example/users/marco-j98/received_events",
      "repos_url": "https://api.github.example/users/marco-j98/repos",
      "site_admin": false,
      "starred_url": "https://api.github.example/users/marco-j98/starred{/owner}{/repo}",
      "subscriptions_url": "https://api.github.example/users/marco-j98/subscriptions",
      "type": "User",
      "url": "https://api.github.example/users/marco-j98",
      "user_view_type": "public"
    }
  },
  {
    "_links": {
      "html": {
        "href": "https://github.example/fernhill-oss/lamina/pull/111#pullrequestreview-1900003798"
      },
      "pull_request": {
        "href": "https://api.github.example/repos/fernhill-oss/lamina/pulls/111"
      }
    },
    "author_association": "OWNER",
    "body": "LGTM, thanks!",
    "commit_id": "821cfc35527d1193cf6e810e8be21671cc33e002",
    "html_url": "https://github.example/fernhill-oss/lamina/pull/111#pullrequestreview-1900003798",
    "id": 1900003798,
    "node_id": "PRR_kwDOhJa24RV3NRE4",
    "pull_request_url": "https://api.github.example/repos/fernhill-oss/lamina/pulls/111",
    "state": "APPROVED",
    "submitted_at": "2025-02-05T14:13:18Z",
    "user": {
      "avatar_url": "https://avatars.github.example/u/1435687?v=4",
      "events_url": "https://api.github.example/users/ines-v/events{/privacy}",
      "followers_url": "https://api.github.example/users/ines-v/followers",
      "following_url": "https://api.github.example/users/ines-v/following{/other_user}",
      "gists_url": "https://api.github.example/users/ines-v/gists{/gist_id}",
      "gravatar_id": "",
      "html_url": "https://github.example/ines-v",
      "id": 1435687,
      "login": "ines-v",
      "node_id": "U_kwDO9-6tTCS76lqQ",
      "organizations_url": "https://api.github.example/users/ines-v/orgs",
      "received_events_url": "https://api.github.example/users/ines-v/received_events",
      "repos_url": "https://api.github.example/users/ines-v/repos",
      "site_admin": false,
      "starred_url": "https://api.github.example/users/ines-v/starred{/owner}{/repo}",
      "subscriptions_url": "https://api.github.example/users/ines-v/subscriptions",
      "type": "User",
      "url": "https://api.github.example/users/ines-v",
      "user_view_type": "public"
    }
  }
]
