[
  {
    "_links": {
      "html": {
        "href": "https://github.example/fernhill-oss/lamina/pull/134#pullrequestreview-1900004412"
      },
      "pull_request": {
        "href": "https://api.github.example/repos/fernhill-oss/lamina/pulls/134"
      }
    },
    "author_association": "OWNER",
    "body": "Close, but a couple of things first.",
    "commit_id": "026b3a1db3884a0ccf5401c29bd10644170ef459",
    "html_url": "https://github.example/fernhill-oss/lamina/pull/134#pullrequestreview-1900004412",
    "id": 1900004412,
    "node_id": "PRR_kwDOzk35Obg4aoYh",
    "pull_request_url": "https://api.github.example/repos/fernhill-oss/lamina/pulls/134",
    "state": "CHANGES_REQUESTED",
    "submitted_at": "2025-05-09T07:28:20Z",
    "user": {
      "avatar_url": "https://avatars.github.example/u/1435687?v=4",
      "events_url": "https://api.github.example/users/ines-v/events{/privacy}",
      "followers_url": "https://api.github.example/users/ines-v/followers",
      "following_url": "https://api.github.example/users/ines-v/following{/other_user}",
      "gists_url": "https://api.github.example/users/ines-v/gists{/gist_id}",
      "gravatar_id": "",
      "html_url": "https://github.example/ines-v",
      "id": 1435687,
      "login": "ines-v",
      "node_id": "U_kwDO9-6tTCS76lqQ",
      "organizations_url": "https://api.github.example/users/ines-v/orgs",
      "received_events_url": "https://api.github.example/users/ines-v/received_events",
      "repos_url": "https://api.github.example/users/ines-v/repos",
      "site_admin": false,
      "starred_url": "https://api.github.example/users/ines-v/starred{/owner}{/repo}",
      "subscriptions_url": "https://api.github.example/users/ines-v/subscriptions",
      "type": "User",
      "url": "https://api.github.example/users/ines-v",
      "user_view_type": "public"
    }
  },
  {
    "_links": {
      "html": {
        "href": "https://github.example/fernhill-oss/lamina/pull/134#pullrequestreview-1900004434"
      },
      "pull_request": {
        "href": "https://api.github.example/repos/fernhill-oss/lamina/pulls/134"
      }
    },
    "author_association": "FIRST_TIME_CONTRIBUTOR",
    "body": "",
    "commit_id": "939727578508217b0182d984844a474d9ca97a85",
    "html_url": "https://github.example/fernhill-oss/lamina/pull/134#pullrequestreview-1900004434",
    "id": 1900004434,
    "node_id": "PRR_kwDOPljVZ9fISoxd",
    "pull_request_url": "https://api.github.example/repos/fernhill-oss/lamina/pulls/134",
    "state": "COMMENTED",
    "submitted_at": "2025-05-09T11:44:50Z",
    "user": {
      "avatar_url": "https://avatars.github.example/u/38805665?v=4",
      "events_url": "https://api.github.example/users/joao-n86/events{/privacy}",
      "followers_url": "https://api.github.example/users/joao-n86/followers",
      "following_url": "https://api.github.example/users/joao-n86/following{/other_user}",
      "gists_url": "https://api.github.example/users/joao-n86/gists{/gist_id}",
      "gravatar_id": "",
      "html_url": "https://github.example/joao-n86",
      "id": 38805665,
      "login": "joao-n86",
      "node_id": "U_kwDOjK4arNPQ-Hk3",
      "organizations_url": "https://api.github.example/users/joao-n86/orgs",
      "received_events_url": "https://api.github.example/users/joao-n86/received_events",
      "repos_url": "https://api.github.example/users/joao-n86/repos",
      "site_admin": false,
      "starred_url": "https://api.github.example/users/joao-n86/starred{/owner}{/repo}",
      "subscriptions_url": "https://api.github.example/users/joao-n86/subscriptions",
      "type": "User",
      "url": "https://api.github.example/users/joao-n86",
      "user_view_type": "public"
    }
  },
  {
    "_links": {
      "html": {
        "href": "https://github.example/fernhill-oss/lamina/pull/134#pullrequestreview-1900004454"
      },
      "pull_request": {
        "href": "https://api.github.example/repos/fernhill-oss/lamina/pulls/134"
      }
    },
    "author_association": "FIRST_TIME_CONTRIBUTOR",
    "body": "",
    "commit_id": "939727578508217b0182d984844a474d9ca97a85",
    "html_url": "https://github.example/fernhill-oss/lamina/pull/134#pullrequestreview-1900004454",
    "id": 1900004454,
    "node_id": "PRR_kwDOoAXIyqoyOaS5",
    "pull_request_url": "https://api.github.example/repos/fernhill-oss/lamina/pulls/134",
    "state": "COMMENTED",
    "submitted_at": "2025-05-09T11:44:50Z",
    "user": {
      "avatar_url": "https://avatars.github.example/u/38805665?v=4",
      "events_url": "https://api.github.example/users/joao-n86/events{/privacy}",
      "followers_url": "https://api.github.example/users/joao-n86/followers",
      "following_url": "https://api.github.example/users/joao-n86/following{/other_user}",
      "gists_url": "https://api.github.example/users/joao-n86/gists{/gist_id}",
      "gravatar_id": "",
      "html_url": "https://github.example/joao-n86",
      "id": 38805665,
      "login": "joao-n86",
      "node_id": "U_kwDOjK4arNPQ-Hk3",
      "organizations_url": "https://api.github.example/users/joao-n86/orgs",
      "received_events_url": "https://api.github.example/users/joao-n86/received_events",
      "repos_url": "https://api.github.example/users/joao-n86/repos",
      "site_admin": false,
      "starred_url": "https://api.github.example/users/joao-n86/starred{/owner}{/repo}",
      "subscriptions_url": "https://api.github.example/users/joao-n86/subscriptions",
      "type": "User",
      "url": "https://api.github.example/users/joao-n86",
      "user_view_type": "public"
    }
  },
  {
    "_links": {
      "html": {
        "href": "https://github.example/fernhill-oss/lamina/pull/134#pullrequestreview-1900004809"
      },
      "pull_request": {
        "href": "https://api.github.example/repos/fernhill-oss/lamina/pulls/134"
      }
    },
    "author_association": "OWNER",
    "body": "Nice work, thanks!",
    "commit_id": "939727578508217b0182d984844a474d9ca97a85",
    "html_url": "https://github.example/fernhill-oss/lamina/pull/134#pullrequestreview-1900004809",
    "id": 1900004809,
    "node_id": "PRR_kwDOKKneitjq6SHF",
    "pull_request_url": "https://api.github.example/repos/fernhill-oss/lamina/pulls/134",
    "state": "APPROVED",
    "submitted_at": "2025-06-05T11:10:21Z",
    "user": {
      "avatar_url": "https://avatars.github.example/u/1435687?v=4",
      "events_url": "https://api.github.example/users/ines-v/events{/privacy}",
      "followers_url": "https://api.github.example/users/ines-v/followers",
      "following_url": "https://api.github.example/users/ines-v/following{/other_user}",
      "gists_url": "https://api.github.example/users/ines-v/gists{/gist_id}",
      "gravatar_id": "",
      "html_url": "https://github.example/ines-v",
      "id": 1435687,
      "login": "ines-v",
      "node_id": "U_kwDO9-6tTCS76lqQ",
      "organizations_url": "https://api.github.example/users/ines-v/orgs",
      "received_events_url": "https://api.github.example/users/ines-v/received_events",
      "repos_url": "https://api.github.example/users/ines-v/repos",
      "site_admin": false,
      "starred_url": "https://api.github.example/users/ines-v/starred{/owner}{/repo}",
      "subscriptions_url": "https://api.github.example/users/ines-v/subscriptions",
      "type": "User",
      "url": "https://api.github.example/users/ines-v",
      "user_view_type": "public"
    }
  }
]
